S&S_Title	Wikidata_ID	Director	Director_gender	Screenwriter	Screenwriter_gender	Original_Title	English_Title	IMDb ID	Genre	RT_Score(%)	IMDb_Rating	Language	Silent	Actors	Runtime(min)	Rated	Country	Year	2022_Poll	2012_Poll	Position_2022	Position_2012	OMDb
La dolce vita	Q18407	Federico Fellini	male	Ennio Flaiano&Tullio Pinelli&Brunello Rondi&Pier Paolo Pasolini&Federico Fellini	male&male&male&male&male	La dolce vita	La dolce vita	tt0053779	Comedy, Drama	96	8.0	Italian, English, French, German	false	Marcello Mastroianni, Anita Ekberg, Anouk Aimée	174	Not Rated	Italy, France	1960	true	true	60	4	"{""Title"":""La dolce vita"",""Year"":""1960"",""Rated"":""Not Rated"",""Released"":""19 Apr 1961"",""Runtime"":""174 min"",""Genre"":""Comedy, Drama"",""Director"":""Federico Fellini"",""Writer"":""Federico Fellini, Ennio Flaiano, Tullio Pinelli"",""Actors"":""Marcello Mastroianni, Anita Ekberg, Anouk Aimée"",""Plot"":""A series of stories following a week in the life of a philandering tabloid journalist living in Rome."",""Language"":""Italian, English, French, German"",""Country"":""Italy, France"",""Awards"":""Won 1 Oscar. 11 wins & 12 nominations total"",""Poster"":""https://m.media-amazon.com/images/M/MV5BODQ0NzY5NGEtYTc5NC00Yjg4LTg4Y2QtZjE2MTkyYTNmNmU2L2ltYWdlL2ltYWdlXkEyXkFqcGdeQXVyNjc1NTYyMjg@._V1_SX300.jpg"",""Ratings"":[{""Source"":""Internet Movie Database"",""Value"":""8.0/10""},{""Source"":""Rotten Tomatoes"",""Value"":""96%""},{""Source"":""Metacritic"",""Value"":""95/100""}],""Metascore"":""95"",""imdbRating"":""8.0"",""imdbVotes"":""73,769"",""imdbID"":""tt0053779"",""Type"":""movie"",""DVD"":""21 Sep 2004"",""BoxOffice"":""N/A"",""Production"":""N/A"",""Website"":""N/A"",""Response"":""True""}"
Psycho	Q163038	Alfred Hitchcock	male	Joseph Stefano&Robert Bloch	male&male	Psycho	Psycho	tt0054215	Horror, Mystery, Thriller	96	8.5	English	false	Anthony Perkins, Janet Leigh, Vera Miles	109	R	United States	1960	true	true	31	35	"{""Title"":""Psycho"",""Year"":""1960"",""Rated"":""R"",""Released"":""08 Sep 1960"",""Runtime"":""109 min"",""Genre"":""Horror, Mystery, Thriller"",""Director"":""Alfred Hitchcock"",""Writer"":""Joseph Stefano, Robert Bloch"",""Actors"":""Anthony Perkins, Janet Leigh, Vera Miles"",""Plot"":""A Phoenix secretary embezzles $40,000 from her employer's client, goes on the run and checks into a remote motel run by a young man under the domination of his mother."",""Language"":""English"",""Country"":""United States"",""Awards"":""Nominated for 4 Oscars. 7 wins & 14 nominations total"",""Poster"":""https://m.media-amazon.com/images/M/MV5BNTQwNDM1YzItNDAxZC00NWY2LTk0M2UtNDIwNWI5OGUyNWUxXkEyXkFqcGdeQXVyNzkwMjQ5NzM@._V1_SX300.jpg"",""Ratings"":[{""Source"":""Internet Movie Database"",""Value"":""8.5/10""},{""Source"":""Rotten Tomatoes"",""Value"":""96%""},{""Source"":""Metacritic"",""Value"":""97/100""}],""Metascore"":""97"",""imdbRating"":""8.5"",""imdbVotes"":""670,743"",""imdbID"":""tt0054215"",""Type"":""movie"",""DVD"":""04 Oct 2005"",""BoxOffice"":""$32,000,000"",""Production"":""N/A"",""Website"":""N/A"",""Response"":""True""}"
The Apartment	Q270510	Billy Wilder	male	Billy Wilder&I. A. L. Diamond	male&male	The Apartment	The Apartment	tt0053604	Comedy, Drama, Romance	93	8.3	English	false	Jack Lemmon, Shirley MacLaine, Fred MacMurray	125	Approved	United States	1960	true	false	54		"{""Title"":""The Apartment"",""Year"":""1960"",""Rated"":""Approved"",""Released"":""29 Jun 1960"",""Runtime"":""125 min"",""Genre"":""Comedy, Drama, Romance"",""Director"":""Billy Wilder"",""Writer"":""Billy Wilder, I.A.L. Diamond"",""Actors"":""Jack Lemmon, Shirley MacLaine, Fred MacMurray"",""Plot"":""A Manhattan insurance clerk tries to rise in his company by letting its executives use his apartment for trysts, but complications and a romance of his own ensue."",""Language"":""English"",""Country"":""United States"",""Awards"":""Won 5 Oscars. 24 wins & 8 nominations total"",""Poster"":""https://m.media-amazon.com/images/M/MV5BNzkwODFjNzItMmMwNi00MTU5LWE2MzktM2M4ZDczZGM1MmViXkEyXkFqcGdeQXVyNDY2MTk1ODk@._V1_SX300.jpg"",""Ratings"":[{""Source"":""Internet Movie Database"",""Value"":""8.3/10""},{""Source"":""Rotten Tomatoes"",""Value"":""93%""},{""Source"":""Metacritic"",""Value"":""94/100""}],""Metascore"":""94"",""imdbRating"":""8.3"",""imdbVotes"":""182,198"",""imdbID"":""tt0053604"",""Type"":""movie"",""DVD"":""04 Mar 2008"",""BoxOffice"":""$18,600,000"",""Production"":""N/A"",""Website"":""N/A"",""Response"":""True""}"
Cléo from 5 to 7	Q1199628	Agnès Varda	female	Agnès Varda	female	Cléo de 5 à 7	Cléo from 5 to 7	tt0055852	Comedy, Drama, Music	92	7.9	French	false	Corinne Marchand, Antoine Bourseiller, Dominique Davray	90	Not Rated	France, Italy	1962	true	false	14		"{""Title"":""Cléo from 5 to 7"",""Year"":""1962"",""Rated"":""Not Rated"",""Released"":""11 Apr 1962"",""Runtime"":""90 min"",""Genre"":""Comedy, Drama, Music"",""Director"":""Agnès Varda"",""Writer"":""Agnès Varda"",""Actors"":""Corinne Marchand, Antoine Bourseiller, Dominique Davray"",""Plot"":""Cleo, a singer and hypochondriac, becomes increasingly worried that she might have cancer while awaiting test results from her doctor."",""Language"":""French"",""Country"":""France, Italy"",""Awards"":""3 wins & 2 nominations"",""Poster"":""https://m.media-amazon.com/images/M/MV5BYTA1Y2QwOWEtOTcwZC00NzJmLWI1ZGUtZTIyNzQ2YjA0ZjE2XkEyXkFqcGdeQXVyODc0OTEyNDU@._V1_SX300.jpg"",""Ratings"":[{""Source"":""Internet Movie Database"",""Value"":""7.9/10""},{""Source"":""Rotten Tomatoes"",""Value"":""92%""}],""Metascore"":""N/A"",""imdbRating"":""7.9"",""imdbVotes"":""22,631"",""imdbID"":""tt0055852"",""Type"":""movie"",""DVD"":""01 Apr 2014"",""BoxOffice"":""N/A"",""Production"":""N/A"",""Website"":""N/A"",""Response"":""True""}"
La Jetée	Q451434	Chris Marker	male	Chris Marker	male	La Jeteé	La Jetée	tt0056119	Short, Drama, Romance	93	8.2	French, German	false	Étienne Becker, Jean Négroni, Hélène Chatelain	28	Not Rated	France	1962	true	true	67	12	"{""Title"":""La Jetée"",""Year"":""1962"",""Rated"":""Not Rated"",""Released"":""16 Feb 1962"",""Runtime"":""28 min"",""Genre"":""Short, Drama, Romance"",""Director"":""Chris Marker"",""Writer"":""Chris Marker"",""Actors"":""Étienne Becker, Jean Négroni, Hélène Chatelain"",""Plot"":""The story of a man forced to explore his memories in the wake of World War III's devastation, told through still images."",""Language"":""French, German"",""Country"":""France"",""Awards"":""2 wins"",""Poster"":""https://m.media-amazon.com/images/M/MV5BODgyNzEyMzEtZjUyOC00YzNiLWE2YTAtNDQ1MzQ0NmY5YjA2XkEyXkFqcGdeQXVyMTA0MTM5NjI2._V1_SX300.jpg"",""Ratings"":[{""Source"":""Internet Movie Database"",""Value"":""8.2/10""},{""Source"":""Rotten Tomatoes"",""Value"":""93%""}],""Metascore"":""N/A"",""imdbRating"":""8.2"",""imdbVotes"":""34,039"",""imdbID"":""tt0056119"",""Type"":""movie"",""DVD"":""26 Jun 2007"",""BoxOffice"":""N/A"",""Production"":""N/A"",""Website"":""N/A"",""Response"":""True""}"
The Leopard	Q596623	Luchino Visconti	male	Suso Cecchi d'Amico&Pasquale Festa Campanile&Enrico Medioli&Massimo Franciosa&Luchino Visconti	female&male&male&male&male	Il Gattopardo	The Leopard	tt0057091	Drama, History	100	8.0	Italian, Latin, French, German	false	Burt Lancaster, Alain Delon, Claudia Cardinale	186	PG	Italy, France	1962	true	true	90	57	"{""Title"":""The Leopard"",""Year"":""1963"",""Rated"":""PG"",""Released"":""29 Mar 1963"",""Runtime"":""186 min"",""Genre"":""Drama, History"",""Director"":""Luchino Visconti"",""Writer"":""Giuseppe Tomasi di Lampedusa, Suso Cecchi D'Amico, Pasquale Festa Campanile"",""Actors"":""Burt Lancaster, Alain Delon, Claudia Cardinale"",""Plot"":""The Prince of Salina, a noble aristocrat of impeccable integrity, tries to preserve his family and class amid the tumultuous social upheavals of 1860s Sicily."",""Language"":""Italian, Latin, French, German"",""Country"":""Italy, France"",""Awards"":""Nominated for 1 Oscar. 10 wins & 6 nominations total"",""Poster"":""https://m.media-amazon.com/images/M/MV5BYTc0ZTQxY2EtNTUyYS00MTM5LWIyOTQtYzQ0YTBiNzc2YjE0XkEyXkFqcGdeQXVyMjUzOTY1NTc@._V1_SX300.jpg"",""Ratings"":[{""Source"":""Internet Movie Database"",""Value"":""8.0/10""},{""Source"":""Rotten Tomatoes"",""Value"":""100%""},{""Source"":""Metacritic"",""Value"":""100/100""}],""Metascore"":""100"",""imdbRating"":""8.0"",""imdbVotes"":""26,249"",""imdbID"":""tt0057091"",""Type"":""movie"",""DVD"":""24 Jun 2003"",""BoxOffice"":""N/A"",""Production"":""N/A"",""Website"":""N/A"",""Response"":""True""}"
L'eclisse	Q1468980	Michelangelo Antonioni	male	Michelangelo Antonioni&Tonino Guerra&Elio Bartolini&Ottiero Ottieri	male&male&male&male	L'Eclisse	L'Eclisse	tt0056736	Drama, Romance	90	7.7	Italian, English	false	Monica Vitti, Alain Delon, Francisco Rabal	126	Not Rated	Italy, France	1962	false	true		73	"{""Title"":""L'Eclisse"",""Year"":""1962"",""Rated"":""Not Rated"",""Released"":""20 Dec 1962"",""Runtime"":""126 min"",""Genre"":""Drama, Romance"",""Director"":""Michelangelo Antonioni"",""Writer"":""Michelangelo Antonioni, Tonino Guerra, Elio Bartolini"",""Actors"":""Monica Vitti, Alain Delon, Francisco Rabal"",""Plot"":""A young woman meets a vital young man, but their love affair is doomed because of the man's materialistic nature."",""Language"":""Italian, English"",""Country"":""Italy, France"",""Awards"":""2 wins & 5 nominations"",""Poster"":""https://m.media-amazon.com/images/M/MV5BOTlmZjMxMzctMmE0MS00NmI1LTg5NTktNjc5ODY1ZDg3NmE4XkEyXkFqcGdeQXVyMTIyNzY1NzM@._V1_SX300.jpg"",""Ratings"":[{""Source"":""Internet Movie Database"",""Value"":""7.7/10""},{""Source"":""Rotten Tomatoes"",""Value"":""90%""}],""Metascore"":""N/A"",""imdbRating"":""7.7"",""imdbVotes"":""20,169"",""imdbID"":""tt0056736"",""Type"":""movie"",""DVD"":""01 Apr 2014"",""BoxOffice"":""N/A"",""Production"":""N/A"",""Website"":""N/A"",""Response"":""True""}"
Lawrence of Arabia	Q228186	David Lean	male	Robert Bolt&Michael Wilson&T. E. Lawrence	male&male&male	Lawrence of Arabia	Lawrence of Arabia	tt0056172	Adventure, Biography, Drama	94	8.3	English, Arabic, Turkish	false	Peter O'Toole, Alec Guinness, Anthony Quinn	218	Approved	United Kingdom	1962	false	true		81	"{""Title"":""Lawrence of Arabia"",""Year"":""1962"",""Rated"":""Approved"",""Released"":""11 Dec 1962"",""Runtime"":""218 min"",""Genre"":""Adventure, Biography, Drama"",""Director"":""David Lean"",""Writer"":""Robert Bolt, Michael Wilson"",""Actors"":""Peter O'Toole, Alec Guinness, Anthony Quinn"",""Plot"":""The story of T.E. Lawrence, the English officer who successfully united and led the diverse, often warring, Arab tribes during World War I in order to fight the Turks."",""Language"":""English, Arabic, Turkish"",""Country"":""United Kingdom"",""Awards"":""Won 7 Oscars. 31 wins & 15 nominations total"",""Poster"":""https://m.media-amazon.com/images/M/MV5BYWY5ZjhjNGYtZmI2Ny00ODM0LWFkNzgtZmI1YzA2N2MxMzA0XkEyXkFqcGdeQXVyNjUwNzk3NDc@._V1_SX300.jpg"",""Ratings"":[{""Source"":""Internet Movie Database"",""Value"":""8.3/10""},{""Source"":""Rotten Tomatoes"",""Value"":""94%""},{""Source"":""Metacritic"",""Value"":""100/100""}],""Metascore"":""100"",""imdbRating"":""8.3"",""imdbVotes"":""294,015"",""imdbID"":""tt0056172"",""Type"":""movie"",""DVD"":""03 Apr 2001"",""BoxOffice"":""$45,306,425"",""Production"":""N/A"",""Website"":""N/A"",""Response"":""True""}"
8½	Q12018	Federico Fellini	male	Ennio Flaiano&Tullio Pinelli&Brunello Rondi&Federico Fellini	male&male&male&male	8½	8½	tt0056801	Drama	98	8.0	Italian, French, English, German	false	Marcello Mastroianni, Anouk Aimée, Claudia Cardinale	138	Not Rated	Italy, France	1963	true	true	31	10	"{""Title"":""8½"",""Year"":""1963"",""Rated"":""Not Rated"",""Released"":""24 Jun 1963"",""Runtime"":""138 min"",""Genre"":""Drama"",""Director"":""Federico Fellini"",""Writer"":""Federico Fellini, Ennio Flaiano, Tullio Pinelli"",""Actors"":""Marcello Mastroianni, Anouk Aimée, Claudia Cardinale"",""Plot"":""A harried movie director retreats into his memories and fantasies."",""Language"":""Italian, French, English, German"",""Country"":""Italy, France"",""Awards"":""Won 2 Oscars. 19 wins & 9 nominations total"",""Poster"":""https://m.media-amazon.com/images/M/MV5BNTkzZTZjOTgtYjgzMS00MTdkLWE2NDAtNTVmM2I3MGYyM2I0XkEyXkFqcGdeQXVyMjUzOTY1NTc@._V1_SX300.jpg"",""Ratings"":[{""Source"":""Internet Movie Database"",""Value"":""8.0/10""},{""Source"":""Rotten Tomatoes"",""Value"":""98%""},{""Source"":""Metacritic"",""Value"":""91/100""}],""Metascore"":""91"",""imdbRating"":""8.0"",""imdbVotes"":""118,545"",""imdbID"":""tt0056801"",""Type"":""movie"",""DVD"":""04 Dec 2001"",""BoxOffice"":""$98,760"",""Production"":""N/A"",""Website"":""N/A"",""Response"":""True""}"
Le Mépris	Q598109	Jean-Luc Godard	male	Jean-Luc Godard	male	Le Mépris	Contempt	tt0057345	Drama, Romance	92	7.5	French, English, German, Italian	false	Brigitte Bardot, Jack Palance, Michel Piccoli	102	Not Rated	France, Italy	1963	true	true	54	21	"{""Title"":""Contempt"",""Year"":""1963"",""Rated"":""Not Rated"",""Released"":""18 Dec 1964"",""Runtime"":""102 min"",""Genre"":""Drama, Romance"",""Director"":""Jean-Luc Godard"",""Writer"":""Alberto Moravia, Jean-Luc Godard"",""Actors"":""Brigitte Bardot, Jack Palance, Michel Piccoli"",""Plot"":""Screenwriter Paul Javal's marriage to his wife Camille disintegrates during movie production as she spends time with the producer. Layered conflicts between art and business ensue."",""Language"":""French, English, German, Italian"",""Country"":""France, Italy"",""Awards"":""1 win & 1 nomination"",""Poster"":""https://m.media-amazon.com/images/M/MV5BMGNhNjYxYmUtMGI5Zi00N2MxLTkzYTctYjEyNWQ1YTk4MTc0XkEyXkFqcGdeQXVyMDI2NDg0NQ@@._V1_SX300.jpg"",""Ratings"":[{""Source"":""Internet Movie Database"",""Value"":""7.5/10""},{""Source"":""Rotten Tomatoes"",""Value"":""92%""}],""Metascore"":""N/A"",""imdbRating"":""7.5"",""imdbVotes"":""32,731"",""imdbID"":""tt0057345"",""Type"":""movie"",""DVD"":""16 Feb 2010"",""BoxOffice"":""$903,986"",""Production"":""N/A"",""Website"":""N/A"",""Response"":""True""}"
Gertrud	Q1253821	Carl Theodor Dreyer	male	Carl Theodor Dreyer&Hjalmar Söderberg	male&male	Gertrud	Gertrud	tt0058138	Drama, Romance	73	7.3	Danish	false	Nina Pens Rode, Bendt Rothe, Ebbe Rode	116	Not Rated	Denmark	1964	false	true		42	"{""Title"":""Gertrud"",""Year"":""1964"",""Rated"":""Not Rated"",""Released"":""02 Jun 1966"",""Runtime"":""116 min"",""Genre"":""Drama, Romance"",""Director"":""Carl Theodor Dreyer"",""Writer"":""Hjalmar Söderberg, Carl Theodor Dreyer"",""Actors"":""Nina Pens Rode, Bendt Rothe, Ebbe Rode"",""Plot"":""In the elegant world of artists and musicians, Gertrud ends her marriage to Gustav and takes a lover, the composer Erland Jansson."",""Language"":""Danish"",""Country"":""Denmark"",""Awards"":""3 wins & 1 nomination"",""Poster"":""https://m.media-amazon.com/images/M/MV5BMDYyMTIwYTMtOGRjNC00Njk4LWE1Y2EtYjhhMDJlNDY2MThkXkEyXkFqcGdeQXVyMTMxMTY0OTQ@._V1_SX300.jpg"",""Ratings"":[{""Source"":""Internet Movie Database"",""Value"":""7.3/10""},{""Source"":""Rotten Tomatoes"",""Value"":""73%""}],""Metascore"":""N/A"",""imdbRating"":""7.3"",""imdbVotes"":""6,361"",""imdbID"":""tt0058138"",""Type"":""movie"",""DVD"":""N/A"",""BoxOffice"":""N/A"",""Production"":""N/A"",""Website"":""N/A"",""Response"":""True""}"
Black Girl	Q3211102	Ousmane Sembène	male	Ousmane Sembène	male	La Noire de...	Black Girl	tt0060758	Drama	97	7.4	French	false	Mbissine Thérèse Diop, Anne-Marie Jelinek, Robert Fontaine	65	Not Rated	Senegal, France	1965	true	false	95		"{""Title"":""Black Girl"",""Year"":""1966"",""Rated"":""Not Rated"",""Released"":""N/A"",""Runtime"":""65 min"",""Genre"":""Drama"",""Director"":""Ousmane Sembene"",""Writer"":""Ousmane Sembene"",""Actors"":""Mbissine Thérèse Diop, Anne-Marie Jelinek, Robert Fontaine"",""Plot"":""A black girl from Senegal becomes a servant in France."",""Language"":""French"",""Country"":""Senegal, France"",""Awards"":""2 wins"",""Poster"":""https://m.media-amazon.com/images/M/MV5BYjJkYmE3YWMtODk4ZC00NGJmLTkzZjMtMzZlY2FjOWVhY2JjXkEyXkFqcGdeQXVyMTQxNzMzNDI@._V1_SX300.jpg"",""Ratings"":[{""Source"":""Internet Movie Database"",""Value"":""7.4/10""},{""Source"":""Rotten Tomatoes"",""Value"":""97%""},{""Source"":""Metacritic"",""Value"":""72/100""}],""Metascore"":""72"",""imdbRating"":""7.4"",""imdbVotes"":""4,674"",""imdbID"":""tt0060758"",""Type"":""movie"",""DVD"":""24 Jan 2017"",""BoxOffice"":""N/A"",""Production"":""N/A"",""Website"":""N/A"",""Response"":""True""}"
Pierrot le fou	Q938851	Jean-Luc Godard	male	Jean-Luc Godard&Remo Forlani	male&male	Pierrot le fou	Pierrot le fou	tt0059592	Crime, Drama, Romance	88	7.5	French, English, Italian	false	Jean-Paul Belmondo, Anna Karina, Graziella Galvani	110	Not Rated	France, Italy	1965	true	true	84	42	"{""Title"":""Pierrot le Fou"",""Year"":""1965"",""Rated"":""Not Rated"",""Released"":""08 Jan 1969"",""Runtime"":""110 min"",""Genre"":""Crime, Drama, Romance"",""Director"":""Jean-Luc Godard"",""Writer"":""Rémo Forlani, Jean-Luc Godard, Lionel White"",""Actors"":""Jean-Paul Belmondo, Anna Karina, Graziella Galvani"",""Plot"":""Pierrot escapes his boring society and travels from Paris to the Mediterranean Sea with Marianne, a girl chased by hit-men from Algeria. They lead an unorthodox life, always on the run."",""Language"":""French, English, Italian"",""Country"":""France, Italy"",""Awards"":""Nominated for 1 BAFTA Award2 wins & 2 nominations total"",""Poster"":""https://m.media-amazon.com/images/M/MV5BMTQ0OTc4MDcxMl5BMl5BanBnXkFtZTgwNjIzMjA0NzE@._V1_SX300.jpg"",""Ratings"":[{""Source"":""Internet Movie Database"",""Value"":""7.5/10""},{""Source"":""Rotten Tomatoes"",""Value"":""88%""}],""Metascore"":""N/A"",""imdbRating"":""7.5"",""imdbVotes"":""34,163"",""imdbID"":""tt0059592"",""Type"":""movie"",""DVD"":""19 Feb 2008"",""BoxOffice"":""$87,011"",""Production"":""N/A"",""Website"":""N/A"",""Response"":""True""}"
Andrei Rublev	Q503046	Andrei Tarkovsky	male	Andrei Tarkovsky&Andrei Konchalovsky	male&male	Андрей Рублёв	Andrei Rublev	tt0060107	Biography, Drama, History	95	8.1	Russian, Italian, Tatar	false	Anatoliy Solonitsyn, Ivan Lapikov, Nikolay Grinko	205	R	Soviet Union	1966	true	true	67	26	"{""Title"":""Andrei Rublev"",""Year"":""1966"",""Rated"":""R"",""Released"":""01 Oct 1973"",""Runtime"":""205 min"",""Genre"":""Biography, Drama, History"",""Director"":""Andrei Tarkovsky"",""Writer"":""Andrey Konchalovskiy, Andrei Tarkovsky"",""Actors"":""Anatoliy Solonitsyn, Ivan Lapikov, Nikolay Grinko"",""Plot"":""The life, times and afflictions of the fifteenth-century Russian iconographer St. Andrei Rublev."",""Language"":""Russian, Italian, Tatar"",""Country"":""Soviet Union"",""Awards"":""5 wins & 2 nominations"",""Poster"":""https://m.media-amazon.com/images/M/MV5BNjM2MjMwNzUzN15BMl5BanBnXkFtZTgwMjEzMzE5MTE@._V1_SX300.jpg"",""Ratings"":[{""Source"":""Internet Movie Database"",""Value"":""8.1/10""},{""Source"":""Rotten Tomatoes"",""Value"":""95%""}],""Metascore"":""N/A"",""imdbRating"":""8.1"",""imdbVotes"":""54,010"",""imdbID"":""tt0060107"",""Type"":""movie"",""DVD"":""02 Feb 1999"",""BoxOffice"":""$124,189"",""Production"":""N/A"",""Website"":""N/A"",""Response"":""True""}"
Au Hasard Balthazar	Q228937	Robert Bresson	male	Robert Bresson	male	Au hasard Balthazar	Au hasard Balthazar	tt0060138	Drama	100	7.8	French, Latin	false	Anne Wiazemsky, Walter Green, François Lafarge	95	Not Rated	France, Sweden	1966	true	true	25	16	"{""Title"":""Au hasard Balthazar"",""Year"":""1966"",""Rated"":""Not Rated"",""Released"":""25 May 1966"",""Runtime"":""95 min"",""Genre"":""Drama"",""Director"":""Robert Bresson"",""Writer"":""Robert Bresson"",""Actors"":""Anne Wiazemsky, Walter Green, François Lafarge"",""Plot"":""The story of a mistreated donkey and the people around him. A study on saintliness and a sister piece to Bresson's Mouchette."",""Language"":""French, Latin"",""Country"":""France, Sweden"",""Awards"":""8 wins & 3 nominations"",""Poster"":""https://m.media-amazon.com/images/M/MV5BYTM5OTRjOWItNGI5My00NTFmLWI3NWMtNTRjMmNiY2E5N2FhXkEyXkFqcGdeQXVyOTk4OTE0NTA@._V1_SX300.jpg"",""Ratings"":[{""Source"":""Internet Movie Database"",""Value"":""7.8/10""},{""Source"":""Rotten Tomatoes"",""Value"":""100%""},{""Source"":""Metacritic"",""Value"":""98/100""}],""Metascore"":""98"",""imdbRating"":""7.8"",""imdbVotes"":""20,533"",""imdbID"":""tt0060138"",""Type"":""movie"",""DVD"":""05 Jul 2005"",""BoxOffice"":""$45,406"",""Production"":""N/A"",""Website"":""N/A"",""Response"":""True""}"
Daisies	Q910705	Věra Chytilová	female	Pavel Juráček&Ester Krumbachová&Věra Chytilová	male&female&female	Sedmikrásky	Daisies	tt0060959	Comedy	85	7.3	Czech	false	Ivana Karbanová, Jitka Cerhová, Marie Cesková	74	Not Rated	Czechoslovakia	1966	true	false	28		"{""Title"":""Daisies"",""Year"":""1966"",""Rated"":""Not Rated"",""Released"":""30 Dec 1966"",""Runtime"":""74 min"",""Genre"":""Comedy"",""Director"":""Vera Chytilová"",""Writer"":""Vera Chytilová, Pavel Jurácek, Ester Krumbachová"",""Actors"":""Ivana Karbanová, Jitka Cerhová, Marie Cesková"",""Plot"":""After realizing that all world is spoiled, Marie and Marie are committed to be spoiled themselves. They rip off older men, feast in lavish meals and do all kinds of mischief. But what is all this leading to?"",""Language"":""Czech"",""Country"":""Czechoslovakia"",""Awards"":""2 wins & 2 nominations"",""Poster"":""https://m.media-amazon.com/images/M/MV5BMGVkNWNmYjktZmI4ZC00OWVhLWIwMDQtNTc3MTBhNzRmNjMzXkEyXkFqcGdeQXVyMTExMTE3NDg5._V1_SX300.jpg"",""Ratings"":[{""Source"":""Internet Movie Database"",""Value"":""7.3/10""},{""Source"":""Rotten Tomatoes"",""Value"":""85%""}],""Metascore"":""N/A"",""imdbRating"":""7.3"",""imdbVotes"":""12,845"",""imdbID"":""tt0060959"",""Type"":""movie"",""DVD"":""13 Jun 2019"",""BoxOffice"":""$13,692"",""Production"":""N/A"",""Website"":""N/A"",""Response"":""True""}"
Persona	Q695255	Ingmar Bergman	male	Ingmar Bergman	male	Persona	Persona	tt0060827	Drama, Thriller	91	8.1	Swedish, English	false	Bibi Andersson, Liv Ullmann, Margaretha Krook	83	Not Rated	Sweden	1966	true	true	18	17	"{""Title"":""Persona"",""Year"":""1966"",""Rated"":""Not Rated"",""Released"":""16 Mar 1967"",""Runtime"":""83 min"",""Genre"":""Drama, Thriller"",""Director"":""Ingmar Bergman"",""Writer"":""Ingmar Bergman"",""Actors"":""Bibi Andersson, Liv Ullmann, Margaretha Krook"",""Plot"":""A nurse is put in charge of a mute actress and finds that their personae are melding together."",""Language"":""Swedish, English"",""Country"":""Sweden"",""Awards"":""Nominated for 1 BAFTA Award11 wins & 5 nominations total"",""Poster"":""https://m.media-amazon.com/images/M/MV5BYmFlOTcxMWUtZTMzMi00NWIyLTkwOTEtNjIxNmViNzc2Yzc1XkEyXkFqcGdeQXVyMjUzOTY1NTc@._V1_SX300.jpg"",""Ratings"":[{""Source"":""Internet Movie Database"",""Value"":""8.1/10""},{""Source"":""Rotten Tomatoes"",""Value"":""91%""},{""Source"":""Metacritic"",""Value"":""86/100""}],""Metascore"":""86"",""imdbRating"":""8.1"",""imdbVotes"":""119,019"",""imdbID"":""tt0060827"",""Type"":""movie"",""DVD"":""10 Feb 2004"",""BoxOffice"":""N/A"",""Production"":""N/A"",""Website"":""N/A"",""Response"":""True""}"
The Battle of Algiers	Q784812	Gillo Pontecorvo	male	Gillo Pontecorvo&Saadi Yacef&Franco Solinas	male&male&male	La Bataille d'alger	The Battle of Algiers	tt0058946	Drama, War	99	8.1	Arabic, French, English	false	Brahim Hadjadj, Jean Martin, Yacef Saadi	121	Not Rated	Italy, Algeria	1966	true	true	45	48	"{""Title"":""The Battle of Algiers"",""Year"":""1966"",""Rated"":""Not Rated"",""Released"":""20 Sep 1967"",""Runtime"":""121 min"",""Genre"":""Drama, War"",""Director"":""Gillo Pontecorvo"",""Writer"":""Franco Solinas, Gillo Pontecorvo"",""Actors"":""Brahim Hadjadj, Jean Martin, Yacef Saadi"",""Plot"":""In the 1950s, fear and violence escalate as the people of Algiers fight for independence from the French government."",""Language"":""Arabic, French, English"",""Country"":""Italy, Algeria"",""Awards"":""Nominated for 3 Oscars. 9 wins & 9 nominations total"",""Poster"":""https://m.media-amazon.com/images/M/MV5BN2M4YTA4ZTEtN2EyNy00YTlmLWE4YzYtYjYyYjRkMWM4ZDM0XkEyXkFqcGdeQXVyMjUzOTY1NTc@._V1_SX300.jpg"",""Ratings"":[{""Source"":""Internet Movie Database"",""Value"":""8.1/10""},{""Source"":""Rotten Tomatoes"",""Value"":""99%""},{""Source"":""Metacritic"",""Value"":""96/100""}],""Metascore"":""96"",""imdbRating"":""8.1"",""imdbVotes"":""60,534"",""imdbID"":""tt0058946"",""Type"":""movie"",""DVD"":""19 Oct 2004"",""BoxOffice"":""$879,794"",""Production"":""N/A"",""Website"":""N/A"",""Response"":""True""}"
