S&S_Title	Wikidata_ID	Director	Director_gender	Screenwriter	Screenwriter_gender	Original_Title	English_Title	IMDb ID	Genre	RT_Score(%)	IMDb_Rating	Language	Silent	Actors	Runtime(min)	Rated	Country	Year	2022_Poll	2012_Poll	Position_2022	Position_2012	OMDb
Playtime	Q1454574	Jacques Tati	male	Jacques Tati&Art Buchwald	male&male	Playtime	Playtime	tt0062136	Comedy	98	7.8	French, English, German	false	Jacques Tati, Barbara Dennek, Rita Maiden	155	Not Rated	France, Italy	1967	true	true	23	42	"{""Title"":""Playtime"",""Year"":""1967"",""Rated"":""Not Rated"",""Released"":""27 Jun 1973"",""Runtime"":""155 min"",""Genre"":""Comedy"",""Director"":""Jacques Tati"",""Writer"":""Jacques Tati, Jacques Lagrange, Art Buchwald"",""Actors"":""Jacques Tati, Barbara Dennek, Rita Maiden"",""Plot"":""Monsieur Hulot curiously wanders around a high-tech Paris, paralleling a trip with a group of American tourists. Meanwhile, a nightclub/restaurant prepares its opening night, but it's still under construction."",""Language"":""French, English, German"",""Country"":""France, Italy"",""Awards"":""4 wins & 2 nominations"",""Poster"":""https://m.media-amazon.com/images/M/MV5BZGJiMjY4MjAtYzA3OS00MDE3LWJlMGQtOTgzMzRhYmQzZjliXkEyXkFqcGdeQXVyNzM0MTUwNTY@._V1_SX300.jpg"",""Ratings"":[{""Source"":""Internet Movie Database"",""Value"":""7.8/10""},{""Source"":""Rotten Tomatoes"",""Value"":""98%""}],""Metascore"":""N/A"",""imdbRating"":""7.8"",""imdbVotes"":""23,343"",""imdbID"":""tt0062136"",""Type"":""movie"",""DVD"":""05 Sep 2006"",""BoxOffice"":""N/A"",""Production"":""N/A"",""Website"":""N/A"",""Response"":""True""}"
2001: A Space Odyssey	Q103474	Stanley Kubrick	male	Arthur C. Clarke&Stanley Kubrick	male&male	2001: A Space Odyssey	2001: A Space Odyssey	tt0062622	Adventure, Sci-Fi	92	8.3	English, Russian, French	false	Keir Dullea, Gary Lockwood, William Sylvester	149	G	United Kingdom, United States	1968	true	true	6	6	"{""Title"":""2001: A Space Odyssey"",""Year"":""1968"",""Rated"":""G"",""Released"":""24 Jun 1970"",""Runtime"":""149 min"",""Genre"":""Adventure, Sci-Fi"",""Director"":""Stanley Kubrick"",""Writer"":""Stanley Kubrick, Arthur C. Clarke"",""Actors"":""Keir Dullea, Gary Lockwood, William Sylvester"",""Plot"":""After uncovering a mysterious artifact buried beneath the Lunar surface, a spacecraft is sent to Jupiter to find its origins - a spacecraft manned by two men and the supercomputer H.A.L. 9000."",""Language"":""English, Russian, French"",""Country"":""United Kingdom, United States"",""Awards"":""Won 1 Oscar. 17 wins & 12 nominations total"",""Poster"":""https://m.media-amazon.com/images/M/MV5BMmNlYzRiNDctZWNhMi00MzI4LThkZTctMTUzMmZkMmFmNThmXkEyXkFqcGdeQXVyNzkwMjQ5NzM@._V1_SX300.jpg"",""Ratings"":[{""Source"":""Internet Movie Database"",""Value"":""8.3/10""},{""Source"":""Rotten Tomatoes"",""Value"":""92%""},{""Source"":""Metacritic"",""Value"":""84/100""}],""Metascore"":""84"",""imdbRating"":""8.3"",""imdbVotes"":""667,754"",""imdbID"":""tt0062622"",""Type"":""movie"",""DVD"":""23 Oct 2007"",""BoxOffice"":""$60,481,243"",""Production"":""N/A"",""Website"":""N/A"",""Response"":""True""}"
Once upon a Time in the West	Q168154	Sergio Leone	male	Sergio Leone&Sergio Donati&Dario Argento&Bernardo Bertolucci	male&male&male&male	Once Upon a Time in the West	Once Upon a Time in the West	tt0064116	Western	95	8.5	Italian, English, Spanish	false	Henry Fonda, Charles Bronson, Claudia Cardinale	165	PG-13	Italy, United States	1968	true	true	95	78	"{""Title"":""Once Upon a Time in the West"",""Year"":""1968"",""Rated"":""PG-13"",""Released"":""04 Jul 1969"",""Runtime"":""165 min"",""Genre"":""Western"",""Director"":""Sergio Leone"",""Writer"":""Sergio Donati, Sergio Leone, Dario Argento"",""Actors"":""Henry Fonda, Charles Bronson, Claudia Cardinale"",""Plot"":""A mysterious stranger with a harmonica joins forces with a notorious desperado to protect a beautiful widow from a ruthless assassin working for the railroad."",""Language"":""Italian, English, Spanish"",""Country"":""Italy, United States"",""Awards"":""5 wins & 5 nominations"",""Poster"":""https://m.media-amazon.com/images/M/MV5BODQ3NDExOGYtMzI3Mi00NWRlLTkwNjAtNjc4MDgzZGJiZTA1XkEyXkFqcGdeQXVyMjUzOTY1NTc@._V1_SX300.jpg"",""Ratings"":[{""Source"":""Internet Movie Database"",""Value"":""8.5/10""},{""Source"":""Rotten Tomatoes"",""Value"":""95%""},{""Source"":""Metacritic"",""Value"":""80/100""}],""Metascore"":""80"",""imdbRating"":""8.5"",""imdbVotes"":""329,463"",""imdbID"":""tt0064116"",""Type"":""movie"",""DVD"":""18 Nov 2003"",""BoxOffice"":""$5,321,508"",""Production"":""N/A"",""Website"":""N/A"",""Response"":""True""}"
The Colour of Pomegranates	Q2235380	Sergei Parajanov	male	Sergei Parajanov	male	Նռան գույնը	The Color of Pomegranates	tt0063555	Biography, Drama, History	94	7.6	Armenian, Azerbaijani, Georgian	false	Sofiko Chiaureli, Melkon Alekyan, Vilen Galstyan	79	Not Rated	Soviet Union	1968	false	true		84	"{""Title"":""The Color of Pomegranates"",""Year"":""1969"",""Rated"":""Not Rated"",""Released"":""27 Jan 1982"",""Runtime"":""79 min"",""Genre"":""Biography, Drama, History"",""Director"":""Sergei Parajanov"",""Writer"":""Sayat Nova, Sergei Parajanov"",""Actors"":""Sofiko Chiaureli, Melkon Alekyan, Vilen Galstyan"",""Plot"":""A surreal biopic of Armenian poet Sayat Nova, told via non-narrative amalgamations of images, hailed as revolutionary by Mikhail Vartanov."",""Language"":""Armenian, Azerbaijani, Georgian"",""Country"":""Soviet Union"",""Awards"":""1 win & 1 nomination"",""Poster"":""https://m.media-amazon.com/images/M/MV5BMTY2MzEzZjQtYjk2Ni00OTljLTk3MTMtYTgwMDMzZjFiNjE3XkEyXkFqcGdeQXVyMTI5Mjg2Ng@@._V1_SX300.jpg"",""Ratings"":[{""Source"":""Internet Movie Database"",""Value"":""7.6/10""},{""Source"":""Rotten Tomatoes"",""Value"":""94%""}],""Metascore"":""N/A"",""imdbRating"":""7.6"",""imdbVotes"":""11,367"",""imdbID"":""tt0063555"",""Type"":""movie"",""DVD"":""11 Jun 2007"",""BoxOffice"":""N/A"",""Production"":""N/A"",""Website"":""N/A"",""Response"":""True""}"
The Wild Bunch	Q994481	Sam Peckinpah	male	Sam Peckinpah&Walon Green	male&male	The Wild Bunch	The Wild Bunch	tt0065214	Action, Adventure, Western	91	7.9	English, Spanish, German	false	William Holden, Ernest Borgnine, Robert Ryan	135	R	United States	1969	false	true		84	"{""Title"":""The Wild Bunch"",""Year"":""1969"",""Rated"":""R"",""Released"":""19 Jun 1969"",""Runtime"":""135 min"",""Genre"":""Action, Adventure, Western"",""Director"":""Sam Peckinpah"",""Writer"":""Walon Green, Sam Peckinpah, Roy N. Sickner"",""Actors"":""William Holden, Ernest Borgnine, Robert Ryan"",""Plot"":""An aging group of outlaws look for one last big score as the \""traditional\"" American West is disappearing around them."",""Language"":""English, Spanish, German"",""Country"":""United States"",""Awards"":""Nominated for 2 Oscars. 6 wins & 8 nominations total"",""Poster"":""https://m.media-amazon.com/images/M/MV5BNGUyYTZmOWItMDJhMi00N2IxLWIyNDMtNjUxM2ZiYmU5YWU1XkEyXkFqcGdeQXVyNjc1NTYyMjg@._V1_SX300.jpg"",""Ratings"":[{""Source"":""Internet Movie Database"",""Value"":""7.9/10""},{""Source"":""Rotten Tomatoes"",""Value"":""91%""},{""Source"":""Metacritic"",""Value"":""97/100""}],""Metascore"":""97"",""imdbRating"":""7.9"",""imdbVotes"":""85,248"",""imdbID"":""tt0065214"",""Type"":""movie"",""DVD"":""10 Jan 2006"",""BoxOffice"":""$638,641"",""Production"":""N/A"",""Website"":""N/A"",""Response"":""True""}"
Wanda	Q381528	Barbara Loden	female	Barbara Loden	female	Wanda	Wanda	tt0067961	Crime, Drama	92	7.1	English	false	Barbara Loden, Michael Higgins, Dorothy Shupenes	102	GP	United States	1970	true	false	48		"{""Title"":""Wanda"",""Year"":""1970"",""Rated"":""GP"",""Released"":""14 Jan 1971"",""Runtime"":""102 min"",""Genre"":""Crime, Drama"",""Director"":""Barbara Loden"",""Writer"":""Barbara Loden"",""Actors"":""Barbara Loden, Michael Higgins, Dorothy Shupenes"",""Plot"":""Wanda, a lonely housewife, drifts through mining country until she meets a petty thief who takes her in."",""Language"":""English"",""Country"":""United States"",""Awards"":""2 wins"",""Poster"":""https://m.media-amazon.com/images/M/MV5BM2MwMTUxZmQtNWFlZS00YjI3LWE5MDMtMTQzOTFhOTE0YjRiXkEyXkFqcGdeQXVyMjUzOTY1NTc@._V1_SX300.jpg"",""Ratings"":[{""Source"":""Internet Movie Database"",""Value"":""7.1/10""},{""Source"":""Rotten Tomatoes"",""Value"":""92%""}],""Metascore"":""N/A"",""imdbRating"":""7.1"",""imdbVotes"":""4,452"",""imdbID"":""tt0067961"",""Type"":""movie"",""DVD"":""25 Jul 2006"",""BoxOffice"":""$51,713"",""Production"":""N/A"",""Website"":""N/A"",""Response"":""True""}"
The Godfather	Q47703	Francis Ford Coppola	male	Mario Puzo&Francis Ford Coppola	male&male	The Godfather	The Godfather	tt0068646	Crime, Drama	97	9.2	English, Italian, Latin	false	Marlon Brando, Al Pacino, James Caan	175	R	United States	1972	true	true	12	21	"{""Title"":""The Godfather"",""Year"":""1972"",""Rated"":""R"",""Released"":""24 Mar 1972"",""Runtime"":""175 min"",""Genre"":""Crime, Drama"",""Director"":""Francis Ford Coppola"",""Writer"":""Mario Puzo, Francis Ford Coppola"",""Actors"":""Marlon Brando, Al Pacino, James Caan"",""Plot"":""The aging patriarch of an organized crime dynasty in postwar New York City transfers control of his clandestine empire to his reluctant youngest son."",""Language"":""English, Italian, Latin"",""Country"":""United States"",""Awards"":""Won 3 Oscars. 32 wins & 30 nominations total"",""Poster"":""https://m.media-amazon.com/images/M/MV5BM2MyNjYxNmUtYTAwNi00MTYxLWJmNWYtYzZlODY3ZTk3OTFlXkEyXkFqcGdeQXVyNzkwMjQ5NzM@._V1_SX300.jpg"",""Ratings"":[{""Source"":""Internet Movie Database"",""Value"":""9.2/10""},{""Source"":""Rotten Tomatoes"",""Value"":""97%""},{""Source"":""Metacritic"",""Value"":""100/100""}],""Metascore"":""100"",""imdbRating"":""9.2"",""imdbVotes"":""1,847,150"",""imdbID"":""tt0068646"",""Type"":""movie"",""DVD"":""11 May 2004"",""BoxOffice"":""$136,381,073"",""Production"":""N/A"",""Website"":""N/A"",""Response"":""True""}"
Aguirre, Wrath of God	Q325662	Werner Herzog	male	Werner Herzog	male	Aguirre, der Zorn Gottes	Aguirre, the Wrath of God	tt0068182	Action, Adventure, Biography	96	7.8	German, Quechua, Spanish	false	Klaus Kinski, Ruy Guerra, Helena Rojo	95	Not Rated	West Germany, Mexico	1972	false	true		90	"{""Title"":""Aguirre, the Wrath of God"",""Year"":""1972"",""Rated"":""Not Rated"",""Released"":""03 Apr 1977"",""Runtime"":""95 min"",""Genre"":""Action, Adventure, Biography"",""Director"":""Werner Herzog"",""Writer"":""Werner Herzog"",""Actors"":""Klaus Kinski, Ruy Guerra, Helena Rojo"",""Plot"":""In the 16th century, the ruthless and insane Don Lope de Aguirre leads a Spanish expedition in search of El Dorado."",""Language"":""German, Quechua, Spanish"",""Country"":""West Germany, Mexico"",""Awards"":""5 wins & 4 nominations"",""Poster"":""https://m.media-amazon.com/images/M/MV5BMjRkY2VhYzMtZWQyNS00OTY2LWE5NTAtYjlhNmQyYzE5MmUxXkEyXkFqcGdeQXVyMTQxNzMzNDI@._V1_SX300.jpg"",""Ratings"":[{""Source"":""Internet Movie Database"",""Value"":""7.8/10""},{""Source"":""Rotten Tomatoes"",""Value"":""96%""}],""Metascore"":""N/A"",""imdbRating"":""7.8"",""imdbVotes"":""57,794"",""imdbID"":""tt0068182"",""Type"":""movie"",""DVD"":""31 Oct 2000"",""BoxOffice"":""N/A"",""Production"":""N/A"",""Website"":""N/A"",""Response"":""True""}"
The Spirit of the Beehive	Q2290517	Víctor Erice	male	Víctor Erice	male	El espíritu de la colmena	The Spirit of the Beehive	tt0070040	Drama, Fantasy	96	7.8	Spanish	false	Fernando Fernán Gómez, Teresa Gimpera, Ana Torrent	98	Not Rated	Spain	1973	true	true	84	81	"{""Title"":""The Spirit of the Beehive"",""Year"":""1973"",""Rated"":""Not Rated"",""Released"":""14 Mar 1975"",""Runtime"":""98 min"",""Genre"":""Drama, Fantasy"",""Director"":""Víctor Erice"",""Writer"":""Ángel Fernández Santos, Víctor Erice"",""Actors"":""Fernando Fernán Gómez, Teresa Gimpera, Ana Torrent"",""Plot"":""In 1940, after watching and being traumatized by the movie Frankenstein (1931), a sensitive seven year-old girl living in a small Spanish village drifts into her own fantasy world."",""Language"":""Spanish"",""Country"":""Spain"",""Awards"":""7 wins & 1 nomination"",""Poster"":""https://m.media-amazon.com/images/M/MV5BZTRjNDQxZjQtNmMzYy00OWZjLWFhNmMtNGU2NDg1NjdjOTVjXkEyXkFqcGdeQXVyMTA0MjU0Ng@@._V1_SX300.jpg"",""Ratings"":[{""Source"":""Internet Movie Database"",""Value"":""7.8/10""},{""Source"":""Rotten Tomatoes"",""Value"":""96%""},{""Source"":""Metacritic"",""Value"":""87/100""}],""Metascore"":""87"",""imdbRating"":""7.8"",""imdbVotes"":""18,847"",""imdbID"":""tt0070040"",""Type"":""movie"",""DVD"":""19 Sep 2006"",""BoxOffice"":""N/A"",""Production"":""N/A"",""Website"":""N/A"",""Response"":""True""}"
Touki Bouki	Q3310901	Djibril Diop Mambéty	male	Djibril Diop Mambéty	male	Touki Bouki	Journey of the Hyena	tt0070820	Drama	86	7.0	Wolof, Arabic, French	false	Magaye Niang, Myriam Niang, Christoph Colomb	85	Not Rated	Senegal	1973	true	true	66	93	"{""Title"":""Journey of the Hyena"",""Year"":""1973"",""Rated"":""Not Rated"",""Released"":""21 Oct 1976"",""Runtime"":""85 min"",""Genre"":""Drama"",""Director"":""Djibril Diop Mambéty"",""Writer"":""Djibril Diop Mambéty"",""Actors"":""Magaye Niang, Myriam Niang, Christoph Colomb"",""Plot"":""Mory, a cowherd, and Anta, a university student, try to make money in order to go to Paris and leave their boring past behind."",""Language"":""Wolof, Arabic, French"",""Country"":""Senegal"",""Awards"":""2 wins & 1 nomination"",""Poster"":""https://m.media-amazon.com/images/M/MV5BN2ExYmM2NjktODBkYy00NTdmLWI4OTEtMGNiYmE3NzY3ZjM0XkEyXkFqcGdeQXVyNDkzNTM2ODg@._V1_SX300.jpg"",""Ratings"":[{""Source"":""Internet Movie Database"",""Value"":""7.0/10""},{""Source"":""Rotten Tomatoes"",""Value"":""86%""}],""Metascore"":""N/A"",""imdbRating"":""7.0"",""imdbVotes"":""3,355"",""imdbID"":""tt0070820"",""Type"":""movie"",""DVD"":""06 Sep 2005"",""BoxOffice"":""N/A"",""Production"":""N/A"",""Website"":""N/A"",""Response"":""True""}"
La maman et la putain	Q2547714	Jean Eustache	male	Jean Eustache	male	La Maman et la Putain	The Mother and the Whore	tt0070359	Drama, Romance	96	7.8	French	false	Bernadette Lafont, Jean-Pierre Léaud, Françoise Lebrun	210	N/A	France	1973	false	true		59	"{""Title"":""The Mother and the Whore"",""Year"":""1973"",""Rated"":""N/A"",""Released"":""17 May 1973"",""Runtime"":""210 min"",""Genre"":""Drama, Romance"",""Director"":""Jean Eustache"",""Writer"":""Jean Eustache"",""Actors"":""Bernadette Lafont, Jean-Pierre Léaud, Françoise Lebrun"",""Plot"":""The chauvinist Alexandre balances relationships with several women, including the maternal Marie and the sexually liberated Veronika, in the post-1968 intellectual scene of Paris."",""Language"":""French"",""Country"":""France"",""Awards"":""3 wins & 1 nomination"",""Poster"":""https://m.media-amazon.com/images/M/MV5BZTEyOTBhMTAtNTFmYi00YmI5LTk2NWQtZDNjZWQ1NzQzMWQzXkEyXkFqcGdeQXVyMTUzMDUzNTI3._V1_SX300.jpg"",""Ratings"":[{""Source"":""Internet Movie Database"",""Value"":""7.8/10""},{""Source"":""Rotten Tomatoes"",""Value"":""96%""}],""Metascore"":""N/A"",""imdbRating"":""7.8"",""imdbVotes"":""5,846"",""imdbID"":""tt0070359"",""Type"":""movie"",""DVD"":""N/A"",""BoxOffice"":""N/A"",""Production"":""N/A"",""Website"":""N/A"",""Response"":""True""}"
Céline and Julie Go Boating	Q734672	Jacques Rivette	male	Jacques Rivette&Eduardo de Gregorio&Juliet Berto&Bulle Ogier&Marie-France Pisier	male&male&female&female&female	Céline et Julie vont en bateau	Celine and Julie Go Boating	tt0071381	Comedy, Drama, Fantasy	97	7.3	French	false	Juliet Berto, Dominique Labourier, Bulle Ogier	193	Unrated	France	1974	true	false	78		"{""Title"":""Celine and Julie Go Boating"",""Year"":""1974"",""Rated"":""Unrated"",""Released"":""18 Sep 1974"",""Runtime"":""193 min"",""Genre"":""Comedy, Drama, Fantasy"",""Director"":""Jacques Rivette"",""Writer"":""Juliet Berto, Dominique Labourier, Bulle Ogier"",""Actors"":""Juliet Berto, Dominique Labourier, Bulle Ogier"",""Plot"":""A mysteriously linked pair of young women find their daily lives preempted by a strange boudoir melodrama that plays itself out in a hallucinatory parallel reality."",""Language"":""French"",""Country"":""France"",""Awards"":""1 win"",""Poster"":""https://m.media-amazon.com/images/M/MV5BYzg0NzljOWMtMGY5Mi00NmU2LWIzNzktZDE3YzNlZWMwZWFkXkEyXkFqcGdeQXVyNTc1NDM0NDU@._V1_SX300.jpg"",""Ratings"":[{""Source"":""Internet Movie Database"",""Value"":""7.3/10""},{""Source"":""Rotten Tomatoes"",""Value"":""97%""}],""Metascore"":""N/A"",""imdbRating"":""7.3"",""imdbVotes"":""5,698"",""imdbID"":""tt0071381"",""Type"":""movie"",""DVD"":""N/A"",""BoxOffice"":""$31,452"",""Production"":""N/A"",""Website"":""N/A"",""Response"":""True""}"
Fear Eats the Soul	Q543810	Rainer Werner Fassbinder	male	Rainer Werner Fassbinder	male	Angst essen Seele auf	Ali: Fear Eats the Soul	tt0071141	Drama, Romance	100	8.0	German, Arabic	false	Brigitte Mira, El Hedi ben Salem, Barbara Valentin	92	Not Rated	West Germany	1974	true	true	52	93	"{""Title"":""Ali: Fear Eats the Soul"",""Year"":""1974"",""Rated"":""Not Rated"",""Released"":""31 Oct 1974"",""Runtime"":""92 min"",""Genre"":""Drama, Romance"",""Director"":""Rainer Werner Fassbinder"",""Writer"":""Rainer Werner Fassbinder"",""Actors"":""Brigitte Mira, El Hedi ben Salem, Barbara Valentin"",""Plot"":""A lonely widow meets a much younger Arab worker in a bar during a rainstorm. They fall in love, to their own surprise and to the outright shock of their families, colleagues, and drinking buddies."",""Language"":""German, Arabic"",""Country"":""West Germany"",""Awards"":""4 wins & 1 nomination"",""Poster"":""https://m.media-amazon.com/images/M/MV5BMTQ5YzM4MGMtYzIwZS00MjliLTg5NDUtZTUxYjJhNTI1NDU3XkEyXkFqcGdeQXVyNjUwMTQ4NjE@._V1_SX300.jpg"",""Ratings"":[{""Source"":""Internet Movie Database"",""Value"":""8.0/10""},{""Source"":""Rotten Tomatoes"",""Value"":""100%""}],""Metascore"":""N/A"",""imdbRating"":""8.0"",""imdbVotes"":""21,786"",""imdbID"":""tt0071141"",""Type"":""movie"",""DVD"":""24 Jun 2003"",""BoxOffice"":""$8,144"",""Production"":""N/A"",""Website"":""N/A"",""Response"":""True""}"
The Godfather Part II	Q184768	Francis Ford Coppola	male	Mario Puzo&Francis Ford Coppola	male&male	The Godfather Part II	The Godfather Part II	tt0071562	Crime, Drama	96	9.0	English, Italian, Spanish, Latin, Sicilian	false	Al Pacino, Robert De Niro, Robert Duvall	202	R	United States	1974	false	true		30	"{""Title"":""The Godfather Part II"",""Year"":""1974"",""Rated"":""R"",""Released"":""18 Dec 1974"",""Runtime"":""202 min"",""Genre"":""Crime, Drama"",""Director"":""Francis Ford Coppola"",""Writer"":""Francis Ford Coppola, Mario Puzo"",""Actors"":""Al Pacino, Robert De Niro, Robert Duvall"",""Plot"":""The early life and career of Vito Corleone in 1920s New York City is portrayed, while his son, Michael, expands and tightens his grip on the family crime syndicate."",""Language"":""English, Italian, Spanish, Latin, Sicilian"",""Country"":""United States"",""Awards"":""Won 6 Oscars. 17 wins & 21 nominations total"",""Poster"":""https://m.media-amazon.com/images/M/MV5BMWMwMGQzZTItY2JlNC00OWZiLWIyMDctNDk2ZDQ2YjRjMWQ0XkEyXkFqcGdeQXVyNzkwMjQ5NzM@._V1_SX300.jpg"",""Ratings"":[{""Source"":""Internet Movie Database"",""Value"":""9.0/10""},{""Source"":""Rotten Tomatoes"",""Value"":""96%""},{""Source"":""Metacritic"",""Value"":""90/100""}],""Metascore"":""90"",""imdbRating"":""9.0"",""imdbVotes"":""1,265,087"",""imdbID"":""tt0071562"",""Type"":""movie"",""DVD"":""24 May 2005"",""BoxOffice"":""$47,834,595"",""Production"":""N/A"",""Website"":""N/A"",""Response"":""True""}"
Chinatown	Q644987	Roman Polanski	male	Robert Towne&Roman Polanski	male&male	Chinatown	Chinatown	tt0071315	Drama, Mystery, Thriller	99	8.2	English, Cantonese, Spanish	false	Jack Nicholson, Faye Dunaway, John Huston	130	R	United States	1974	false	true		78	"{""Title"":""Chinatown"",""Year"":""1974"",""Rated"":""R"",""Released"":""20 Jun 1974"",""Runtime"":""130 min"",""Genre"":""Drama, Mystery, Thriller"",""Director"":""Roman Polanski"",""Writer"":""Robert Towne, Roman Polanski"",""Actors"":""Jack Nicholson, Faye Dunaway, John Huston"",""Plot"":""A private detective hired to expose an adulterer in 1930s Los Angeles finds himself caught up in a web of deceit, corruption, and murder."",""Language"":""English, Cantonese, Spanish"",""Country"":""United States"",""Awards"":""Won 1 Oscar. 22 wins & 25 nominations total"",""Poster"":""https://m.media-amazon.com/images/M/MV5BMjJkMDZhYzItZTFhMi00ZGI4LThlNTAtZDNlYmEwNjFkNDYzXkEyXkFqcGdeQXVyMjUzOTY1NTc@._V1_SX300.jpg"",""Ratings"":[{""Source"":""Internet Movie Database"",""Value"":""8.2/10""},{""Source"":""Rotten Tomatoes"",""Value"":""99%""},{""Source"":""Metacritic"",""Value"":""92/100""}],""Metascore"":""92"",""imdbRating"":""8.2"",""imdbVotes"":""327,246"",""imdbID"":""tt0071315"",""Type"":""movie"",""DVD"":""23 Nov 1999"",""BoxOffice"":""$29,200,000"",""Production"":""N/A"",""Website"":""N/A"",""Response"":""True""}"
Barry Lyndon	Q471716	Stanley Kubrick	male	Stanley Kubrick	male	Barry Lyndon	Barry Lyndon	tt0072684	Adventure, Drama, War	89	8.1	English, German, French	false	Ryan O'Neal, Marisa Berenson, Patrick Magee	185	PG	United Kingdom, United States	1975	true	true	45	59	"{""Title"":""Barry Lyndon"",""Year"":""1975"",""Rated"":""PG"",""Released"":""18 Dec 1975"",""Runtime"":""185 min"",""Genre"":""Adventure, Drama, War"",""Director"":""Stanley Kubrick"",""Writer"":""Stanley Kubrick, William Makepeace Thackeray"",""Actors"":""Ryan O'Neal, Marisa Berenson, Patrick Magee"",""Plot"":""An Irish rogue wins the heart of a rich widow and assumes her dead husband's aristocratic position in 18th-century England."",""Language"":""English, German, French"",""Country"":""United Kingdom, United States"",""Awards"":""Won 4 Oscars. 19 wins & 15 nominations total"",""Poster"":""https://m.media-amazon.com/images/M/MV5BNmY0MWY2NDctZDdmMi00MjA1LTk0ZTQtZDMyZTQ1NTNlYzVjXkEyXkFqcGdeQXVyMjUzOTY1NTc@._V1_SX300.jpg"",""Ratings"":[{""Source"":""Internet Movie Database"",""Value"":""8.1/10""},{""Source"":""Rotten Tomatoes"",""Value"":""89%""},{""Source"":""Metacritic"",""Value"":""89/100""}],""Metascore"":""89"",""imdbRating"":""8.1"",""imdbVotes"":""168,759"",""imdbID"":""tt0072684"",""Type"":""movie"",""DVD"":""18 Aug 2008"",""BoxOffice"":""N/A"",""Production"":""N/A"",""Website"":""N/A"",""Response"":""True""}"
Jeanne Dielman, 23, quai du Commerce, 1080 Bruxelles	Q1686012	Chantal Akerman	female	Chantal Akerman	female	Jeanne Dielman, 23, quai du commerce, 1080 Bruxelles	Jeanne Dielman, 23, quai du commerce, 1080 Bruxelles	tt0073198	Drama	97	7.7	French	false	Delphine Seyrig, Jan Decorte, Henri Storck	202	Not Rated	Belgium, France	1975	true	true	1	35	"{""Title"":""Jeanne Dielman, 23, quai du commerce, 1080 Bruxelles"",""Year"":""1975"",""Rated"":""Not Rated"",""Released"":""21 Jan 1976"",""Runtime"":""202 min"",""Genre"":""Drama"",""Director"":""Chantal Akerman"",""Writer"":""Chantal Akerman"",""Actors"":""Delphine Seyrig, Jan Decorte, Henri Storck"",""Plot"":""A lonely widowed housewife does her daily chores, takes care of her apartment where she lives with her teenage son, and turns the occasional trick to make ends meet. However, something happens that changes her safe routine."",""Language"":""French"",""Country"":""Belgium, France"",""Awards"":""2 wins"",""Poster"":""https://m.media-amazon.com/images/M/MV5BMzdmYjM0YmUtNDc0Ny00ZjM5LWFjYzMtZWJmNDVkY2U4ZjA2XkEyXkFqcGdeQXVyODU1OTc0MzI@._V1_SX300.jpg"",""Ratings"":[{""Source"":""Internet Movie Database"",""Value"":""7.7/10""},{""Source"":""Rotten Tomatoes"",""Value"":""97%""}],""Metascore"":""N/A"",""imdbRating"":""7.7"",""imdbVotes"":""9,242"",""imdbID"":""tt0073198"",""Type"":""movie"",""DVD"":""25 Aug 2009"",""BoxOffice"":""$19,858"",""Production"":""N/A"",""Website"":""N/A"",""Response"":""True""}"
Mirror	Q838149	Andrei Tarkovsky	male	Andrei Tarkovsky&Aleksandr Misharin	male&male	Зеркало	Mirror	tt0072443	Biography, Drama	100	8.0	Russian, Spanish	false	Margarita Terekhova, Filipp Yankovskiy, Ignat Daniltsev	107	Not Rated	Soviet Union	1975	true	true	31	19	"{""Title"":""Mirror"",""Year"":""1975"",""Rated"":""Not Rated"",""Released"":""07 Mar 1975"",""Runtime"":""107 min"",""Genre"":""Biography, Drama"",""Director"":""Andrei Tarkovsky"",""Writer"":""Aleksandr Misharin, Arseniy Tarkovskiy, Andrei Tarkovsky"",""Actors"":""Margarita Terekhova, Filipp Yankovskiy, Ignat Daniltsev"",""Plot"":""A dying man in his forties remembers his past. His childhood, his mother, the war, personal moments and things that tell of the recent history of all the Russian nation."",""Language"":""Russian, Spanish"",""Country"":""Soviet Union"",""Awards"":""1 win & 2 nominations"",""Poster"":""https://m.media-amazon.com/images/M/MV5BOGRiNDc0ZmMtZWVmNS00ZmRkLWEwNjQtODdmYTIyZGJjMjc5XkEyXkFqcGdeQXVyMTQxNzMzNDI@._V1_SX300.jpg"",""Ratings"":[{""Source"":""Internet Movie Database"",""Value"":""8.0/10""},{""Source"":""Rotten Tomatoes"",""Value"":""100%""},{""Source"":""Metacritic"",""Value"":""80/100""}],""Metascore"":""80"",""imdbRating"":""8.0"",""imdbVotes"":""47,287"",""imdbID"":""tt0072443"",""Type"":""movie"",""DVD"":""01 Mar 2007"",""BoxOffice"":""$22,168"",""Production"":""N/A"",""Website"":""N/A"",""Response"":""True""}"
