S&S_Title	Wikidata_ID	Director	Director_gender	Screenwriter	Screenwriter_gender	Original_Title	English_Title	IMDb ID	Genre	RT_Score(%)	IMDb_Rating	Language	Silent	Actors	Runtime(min)	Rated	Country	Year	2022_Poll	2012_Poll	Position_2022	Position_2012	OMDb
Seven Samurai	Q189540	Akira Kurosawa	male	Akira Kurosawa&Shinobu Hashimoto&Hideo Oguni	male&male&male	七人の侍	Seven Samurai	tt0047478	Action, Drama	100	8.6	Japanese	false	Toshirô Mifune, Takashi Shimura, Keiko Tsushima	207	Not Rated	Japan	1954	true	true	20	17	"{""Title"":""Seven Samurai"",""Year"":""1954"",""Rated"":""Not Rated"",""Released"":""19 Nov 1956"",""Runtime"":""207 min"",""Genre"":""Action, Drama"",""Director"":""Akira Kurosawa"",""Writer"":""Akira Kurosawa, Shinobu Hashimoto, Hideo Oguni"",""Actors"":""Toshirô Mifune, Takashi Shimura, Keiko Tsushima"",""Plot"":""Farmers from a village exploited by bandits hire a veteran samurai for protection, who gathers six other samurai to join him. As the samurai teach the peasants how to defend themselves, the village is attacked by an army of bandits."",""Language"":""Japanese"",""Country"":""Japan"",""Awards"":""Nominated for 2 Oscars. 5 wins & 8 nominations total"",""Poster"":""https://m.media-amazon.com/images/M/MV5BNWQ3OTM4ZGItMWEwZi00MjI5LWI3YzgtNTYwNWRkNmIzMGI5XkEyXkFqcGdeQXVyNDY2MTk1ODk@._V1_SX300.jpg"",""Ratings"":[{""Source"":""Internet Movie Database"",""Value"":""8.6/10""},{""Source"":""Rotten Tomatoes"",""Value"":""100%""},{""Source"":""Metacritic"",""Value"":""98/100""}],""Metascore"":""98"",""imdbRating"":""8.6"",""imdbVotes"":""345,850"",""imdbID"":""tt0047478"",""Type"":""movie"",""DVD"":""05 Sep 2006"",""BoxOffice"":""$318,649"",""Production"":""N/A"",""Website"":""N/A"",""Response"":""True""}"
Ordet	Q2352630	Carl Theodor Dreyer	male	Carl Theodor Dreyer&Kaj Munk	male&male	Ordet	Ordet	tt0048452	Drama	100	8.3	Danish	false	Henrik Malberg, Emil Hass Christensen, Preben Lerdorff Rye	126	Not Rated	Denmark	1955	true	true	48	24	"{""Title"":""Ordet"",""Year"":""1955"",""Rated"":""Not Rated"",""Released"":""10 Jan 1955"",""Runtime"":""126 min"",""Genre"":""Drama"",""Director"":""Carl Theodor Dreyer"",""Writer"":""Kaj Munk, Carl Theodor Dreyer"",""Actors"":""Henrik Malberg, Emil Hass Christensen, Preben Lerdorff Rye"",""Plot"":""Follows the lives of the Borgen family, as they deal with inner conflict, as well as religious conflict with each other, and the rest of the town."",""Language"":""Danish"",""Country"":""Denmark"",""Awards"":""7 wins & 2 nominations"",""Poster"":""https://m.media-amazon.com/images/M/MV5BYjFjYzQ4ZTgtZGQ3MS00NDE2LTlmOTktYTIwOWIwMWVkYjcxL2ltYWdlL2ltYWdlXkEyXkFqcGdeQXVyNTc2MDU0NDE@._V1_SX300.jpg"",""Ratings"":[{""Source"":""Internet Movie Database"",""Value"":""8.3/10""},{""Source"":""Rotten Tomatoes"",""Value"":""100%""}],""Metascore"":""N/A"",""imdbRating"":""8.3"",""imdbVotes"":""16,031"",""imdbID"":""tt0048452"",""Type"":""movie"",""DVD"":""11 May 2010"",""BoxOffice"":""N/A"",""Production"":""N/A"",""Website"":""N/A"",""Response"":""True""}"
Pather Panchali	Q622380	Satyajit Ray	male	Satyajit Ray	male	পথের পাঁচালী	Pather Panchali	tt0048473	Drama	98	8.3	Bengali	false	Kanu Bannerjee, Karuna Bannerjee, Subir Banerjee	125	Not Rated	India	1955	true	true	35	42	"{""Title"":""Pather Panchali"",""Year"":""1955"",""Rated"":""Not Rated"",""Released"":""26 Aug 1955"",""Runtime"":""125 min"",""Genre"":""Drama"",""Director"":""Satyajit Ray"",""Writer"":""Bibhutibhushan Bandyopadhyay, Satyajit Ray"",""Actors"":""Kanu Bannerjee, Karuna Bannerjee, Subir Banerjee"",""Plot"":""Impoverished priest Harihar Ray, dreaming of a better life for himself and his family, leaves his rural Bengal village in search of work."",""Language"":""Bengali"",""Country"":""India"",""Awards"":""Nominated for 1 BAFTA Award11 wins & 2 nominations total"",""Poster"":""https://m.media-amazon.com/images/M/MV5BMmFkNDY5OTktNzY3Yy00OTFlLThhNjktOTRhMmZjZmIxYjAxXkEyXkFqcGdeQXVyNTgyNTA4MjM@._V1_SX300.jpg"",""Ratings"":[{""Source"":""Internet Movie Database"",""Value"":""8.3/10""},{""Source"":""Rotten Tomatoes"",""Value"":""98%""}],""Metascore"":""N/A"",""imdbRating"":""8.3"",""imdbVotes"":""33,358"",""imdbID"":""tt0048473"",""Type"":""movie"",""DVD"":""17 Nov 2015"",""BoxOffice"":""$134,241"",""Production"":""N/A"",""Website"":""N/A"",""Response"":""True""}"
The Night of the Hunter	Q1132629	Charles Laughton	male	James Agee&Davis Grubb&Charles Laughton	male&male&male	The Night of the Hunter	The Night of the Hunter	tt0048424	Crime, Drama, Film-Noir	93	8.0	English	false	Robert Mitchum, Shelley Winters, Lillian Gish	92	Not Rated	United States	1955	true	true	25	63	"{""Title"":""The Night of the Hunter"",""Year"":""1955"",""Rated"":""Not Rated"",""Released"":""27 Jul 1955"",""Runtime"":""92 min"",""Genre"":""Crime, Drama, Film-Noir"",""Director"":""Charles Laughton"",""Writer"":""Davis Grubb, James Agee, Charles Laughton"",""Actors"":""Robert Mitchum, Shelley Winters, Lillian Gish"",""Plot"":""A religious fanatic marries a gullible widow whose young children are reluctant to tell him where their real daddy hid the $10,000 he'd stolen in a robbery."",""Language"":""English"",""Country"":""United States"",""Awards"":""2 wins"",""Poster"":""https://m.media-amazon.com/images/M/MV5BYTNjN2M2MzYtZGEwMi00Mzc5LWEwYTMtODM1ZmRiZjFiNTU0L2ltYWdlL2ltYWdlXkEyXkFqcGdeQXVyNjc1NTYyMjg@._V1_SX300.jpg"",""Ratings"":[{""Source"":""Internet Movie Database"",""Value"":""8.0/10""},{""Source"":""Rotten Tomatoes"",""Value"":""93%""},{""Source"":""Metacritic"",""Value"":""99/100""}],""Metascore"":""99"",""imdbRating"":""8.0"",""imdbVotes"":""89,979"",""imdbID"":""tt0048424"",""Type"":""movie"",""DVD"":""25 Jan 2000"",""BoxOffice"":""N/A"",""Production"":""N/A"",""Website"":""N/A"",""Response"":""True""}"
A Man Escaped	Q2385009	Robert Bresson	male	Robert Bresson	male	Un condamné à mort s'est échappé	A Man Escaped	tt0049902	Drama, Thriller, War	100	8.3	French, German	false	François Leterrier, Charles Le Clainche, Maurice Beerblock	101	Not Rated	France	1956	true	true	95	69	"{""Title"":""A Man Escaped"",""Year"":""1956"",""Rated"":""Not Rated"",""Released"":""26 Aug 1957"",""Runtime"":""101 min"",""Genre"":""Drama, Thriller, War"",""Director"":""Robert Bresson"",""Writer"":""André Devigny, Robert Bresson"",""Actors"":""François Leterrier, Charles Le Clainche, Maurice Beerblock"",""Plot"":""A captured French Resistance fighter during WWII engineers a daunting escape from a Nazi prison in France."",""Language"":""French, German"",""Country"":""France"",""Awards"":""Nominated for 1 BAFTA Award4 wins & 3 nominations total"",""Poster"":""https://m.media-amazon.com/images/M/MV5BYzMyYTFjYzAtOTczYS00NTU0LTg1Y2EtN2UwN2RkMDNjZDA1L2ltYWdlL2ltYWdlXkEyXkFqcGdeQXVyMjgyNjk3MzE@._V1_SX300.jpg"",""Ratings"":[{""Source"":""Internet Movie Database"",""Value"":""8.3/10""},{""Source"":""Rotten Tomatoes"",""Value"":""100%""}],""Metascore"":""N/A"",""imdbRating"":""8.3"",""imdbVotes"":""22,597"",""imdbID"":""tt0049902"",""Type"":""movie"",""DVD"":""26 Mar 2013"",""BoxOffice"":""N/A"",""Production"":""N/A"",""Website"":""N/A"",""Response"":""True""}"
The Searchers	Q276769	John Ford	male	Frank S. Nugent	male	The Searchers	The Searchers	tt0049730	Adventure, Drama, Western	94	7.9	English, Navajo, Spanish	false	John Wayne, Jeffrey Hunter, Vera Miles	119	Passed	United States	1956	true	true	15	7	"{""Title"":""The Searchers"",""Year"":""1956"",""Rated"":""Passed"",""Released"":""26 May 1956"",""Runtime"":""119 min"",""Genre"":""Adventure, Drama, Western"",""Director"":""John Ford"",""Writer"":""Frank S. Nugent, Alan Le May"",""Actors"":""John Wayne, Jeffrey Hunter, Vera Miles"",""Plot"":""An American Civil War veteran embarks on a years-long journey to rescue his niece from the Comanches after the rest of his brother's family is massacred in a raid on their Texas farm."",""Language"":""English, Navajo, Spanish"",""Country"":""United States"",""Awards"":""3 wins & 3 nominations"",""Poster"":""https://m.media-amazon.com/images/M/MV5BYWQ3YWJiMDEtMDBhNS00YjY1LTkzNmEtY2U4Njg4MjQ3YWE3XkEyXkFqcGdeQXVyNzkwMjQ5NzM@._V1_SX300.jpg"",""Ratings"":[{""Source"":""Internet Movie Database"",""Value"":""7.9/10""},{""Source"":""Rotten Tomatoes"",""Value"":""94%""},{""Source"":""Metacritic"",""Value"":""94/100""}],""Metascore"":""94"",""imdbRating"":""7.9"",""imdbVotes"":""90,070"",""imdbID"":""tt0049730"",""Type"":""movie"",""DVD"":""06 Jun 2006"",""BoxOffice"":""N/A"",""Production"":""N/A"",""Website"":""N/A"",""Response"":""True""}"
Wild Strawberries	Q239756	Ingmar Bergman	male	Ingmar Bergman	male	Smultronstället	Wild Strawberries	tt0050986	Drama, Romance	94	8.1	Swedish, Latin	false	Victor Sjöström, Bibi Andersson, Ingrid Thulin	91	Not Rated	Sweden	1957	false	true		63	"{""Title"":""Wild Strawberries"",""Year"":""1957"",""Rated"":""Not Rated"",""Released"":""22 Jun 1959"",""Runtime"":""91 min"",""Genre"":""Drama, Romance"",""Director"":""Ingmar Bergman"",""Writer"":""Ingmar Bergman"",""Actors"":""Victor Sjöström, Bibi Andersson, Ingrid Thulin"",""Plot"":""After living a life marked by coldness, an aging professor is forced to confront the emptiness of his existence."",""Language"":""Swedish, Latin"",""Country"":""Sweden"",""Awards"":""Nominated for 1 Oscar. 18 wins & 4 nominations total"",""Poster"":""https://m.media-amazon.com/images/M/MV5BYWQxYzdhMDMtNjAyZC00NzE0LWFjYmQtYjk0YzMyYjA5NzZkXkEyXkFqcGdeQXVyMjUzOTY1NTc@._V1_SX300.jpg"",""Ratings"":[{""Source"":""Internet Movie Database"",""Value"":""8.1/10""},{""Source"":""Rotten Tomatoes"",""Value"":""94%""},{""Source"":""Metacritic"",""Value"":""88/100""}],""Metascore"":""88"",""imdbRating"":""8.1"",""imdbVotes"":""107,650"",""imdbID"":""tt0050986"",""Type"":""movie"",""DVD"":""12 Feb 2002"",""BoxOffice"":""N/A"",""Production"":""N/A"",""Website"":""N/A"",""Response"":""True""}"
The Seventh Seal	Q217189	Ingmar Bergman	male	Ingmar Bergman	male	Det sjunde inseglet	The Seventh Seal	tt0050976	Drama, Fantasy	93	8.1	Swedish, Latin	false	Max von Sydow, Gunnar Björnstrand, Bengt Ekerot	96	Not Rated	Sweden	1957	false	true		93	"{""Title"":""The Seventh Seal"",""Year"":""1957"",""Rated"":""Not Rated"",""Released"":""13 Oct 1958"",""Runtime"":""96 min"",""Genre"":""Drama, Fantasy"",""Director"":""Ingmar Bergman"",""Writer"":""Ingmar Bergman"",""Actors"":""Max von Sydow, Gunnar Björnstrand, Bengt Ekerot"",""Plot"":""A knight returning to Sweden after the Crusades seeks answers about life, death, and the existence of God as he plays chess against the Grim Reaper during the Black Plague."",""Language"":""Swedish, Latin"",""Country"":""Sweden"",""Awards"":""10 wins & 2 nominations"",""Poster"":""https://m.media-amazon.com/images/M/MV5BOWM3MmE0OGYtOGVlNC00OWE1LTk5ZTAtYmUwMDIwM2ZlNWJiXkEyXkFqcGdeQXVyMjUzOTY1NTc@._V1_SX300.jpg"",""Ratings"":[{""Source"":""Internet Movie Database"",""Value"":""8.1/10""},{""Source"":""Rotten Tomatoes"",""Value"":""93%""},{""Source"":""Metacritic"",""Value"":""88/100""}],""Metascore"":""88"",""imdbRating"":""8.1"",""imdbVotes"":""185,923"",""imdbID"":""tt0050976"",""Type"":""movie"",""DVD"":""04 Dec 2007"",""BoxOffice"":""N/A"",""Production"":""N/A"",""Website"":""N/A"",""Response"":""True""}"
Vertigo	Q202548	Alfred Hitchcock	male	Alec Coppel&Samuel A. Taylor&Maxwell Anderson&Boileau-Narcejac&Thomas Narcejac	male&male&male&male	Vertigo	Vertigo	tt0052357	Mystery, Romance, Thriller	93	8.3	English	false	James Stewart, Kim Novak, Barbara Bel Geddes	128	PG	United States	1958	true	true	2	1	"{""Title"":""Vertigo"",""Year"":""1958"",""Rated"":""PG"",""Released"":""22 May 1958"",""Runtime"":""128 min"",""Genre"":""Mystery, Romance, Thriller"",""Director"":""Alfred Hitchcock"",""Writer"":""Alec Coppel, Samuel A. Taylor, Pierre Boileau"",""Actors"":""James Stewart, Kim Novak, Barbara Bel Geddes"",""Plot"":""A former San Francisco police detective juggles wrestling with his personal demons and becoming obsessed with the hauntingly beautiful woman he has been hired to trail, who may be deeply disturbed."",""Language"":""English"",""Country"":""United States"",""Awards"":""Nominated for 2 Oscars. 9 wins & 7 nominations total"",""Poster"":""https://m.media-amazon.com/images/M/MV5BYTE4ODEwZDUtNDFjOC00NjAxLWEzYTQtYTI1NGVmZmFlNjdiL2ltYWdlL2ltYWdlXkEyXkFqcGdeQXVyNjc1NTYyMjg@._V1_SX300.jpg"",""Ratings"":[{""Source"":""Internet Movie Database"",""Value"":""8.3/10""},{""Source"":""Rotten Tomatoes"",""Value"":""93%""},{""Source"":""Metacritic"",""Value"":""100/100""}],""Metascore"":""100"",""imdbRating"":""8.3"",""imdbVotes"":""402,208"",""imdbID"":""tt0052357"",""Type"":""movie"",""DVD"":""25 Jan 2001"",""BoxOffice"":""$7,705,225"",""Production"":""N/A"",""Website"":""N/A"",""Response"":""True""}"
Touch of Evil	Q778161	Orson Welles	male	Orson Welles&Paul Monash&Whit Masterson	male&male	Touch of Evil	Touch of Evil	tt0052311	Crime, Drama, Film-Noir	95	8.0	English, Spanish	false	Charlton Heston, Orson Welles, Janet Leigh	95	PG-13	United States	1958	false	true		57	"{""Title"":""Touch of Evil"",""Year"":""1958"",""Rated"":""PG-13"",""Released"":""23 Apr 1958"",""Runtime"":""95 min"",""Genre"":""Crime, Drama, Film-Noir"",""Director"":""Orson Welles"",""Writer"":""Orson Welles, Whit Masterson, Franklin Coen"",""Actors"":""Charlton Heston, Orson Welles, Janet Leigh"",""Plot"":""A stark, perverse story of murder, kidnapping, and police corruption in a Mexican border town."",""Language"":""English, Spanish"",""Country"":""United States"",""Awards"":""8 wins & 2 nominations"",""Poster"":""https://m.media-amazon.com/images/M/MV5BOTA1MjA3M2EtMmJjZS00OWViLTkwMTEtM2E5ZDk0NTAyNGJiXkEyXkFqcGdeQXVyNzkwMjQ5NzM@._V1_SX300.jpg"",""Ratings"":[{""Source"":""Internet Movie Database"",""Value"":""8.0/10""},{""Source"":""Rotten Tomatoes"",""Value"":""95%""},{""Source"":""Metacritic"",""Value"":""99/100""}],""Metascore"":""99"",""imdbRating"":""8.0"",""imdbVotes"":""105,223"",""imdbID"":""tt0052311"",""Type"":""movie"",""DVD"":""06 Jul 2004"",""BoxOffice"":""$2,247,465"",""Production"":""N/A"",""Website"":""N/A"",""Response"":""True""}"
Rio Bravo	Q1008351	Howard Hawks&Paul Helmick	male&male	Leigh Brackett&Jules Furthman	female&male	Rio Bravo	Rio Bravo	tt0053221	Western	98	8.0	English, Spanish	false	John Wayne, Dean Martin, Ricky Nelson	141	Passed	United States	1958	false	true		63	"{""Title"":""Rio Bravo"",""Year"":""1959"",""Rated"":""Passed"",""Released"":""04 Apr 1959"",""Runtime"":""141 min"",""Genre"":""Western"",""Director"":""Howard Hawks"",""Writer"":""Jules Furthman, Leigh Brackett, B.H. McCampbell"",""Actors"":""John Wayne, Dean Martin, Ricky Nelson"",""Plot"":""A small-town sheriff in the American West enlists the help of a disabled man, a drunk, and a young gunfighter in his efforts to hold in jail the brother of the local bad guy."",""Language"":""English, Spanish"",""Country"":""United States"",""Awards"":""4 wins & 6 nominations"",""Poster"":""https://m.media-amazon.com/images/M/MV5BZDVhMTk1NjUtYjc0OS00OTE1LTk1NTYtYWMzMDI5OTlmYzU2XkEyXkFqcGdeQXVyNjc1NTYyMjg@._V1_SX300.jpg"",""Ratings"":[{""Source"":""Internet Movie Database"",""Value"":""8.0/10""},{""Source"":""Rotten Tomatoes"",""Value"":""98%""},{""Source"":""Metacritic"",""Value"":""93/100""}],""Metascore"":""93"",""imdbRating"":""8.0"",""imdbVotes"":""63,282"",""imdbID"":""tt0053221"",""Type"":""movie"",""DVD"":""22 May 2007"",""BoxOffice"":""$12,535,000"",""Production"":""N/A"",""Website"":""N/A"",""Response"":""True""}"
Imitation of Life	Q373774	Douglas Sirk	male	Allan Scott&Eleanore Griffin&Fannie Hurst	male&female&female	Imitation of Life	Imitation of Life	tt0052918	Drama	82	7.8	English	false	Lana Turner, John Gavin, Sandra Dee	125	Not Rated	United States	1959	true	true	75	93	"{""Title"":""Imitation of Life"",""Year"":""1959"",""Rated"":""Not Rated"",""Released"":""20 Mar 1959"",""Runtime"":""125 min"",""Genre"":""Drama"",""Director"":""Douglas Sirk"",""Writer"":""Eleanore Griffin, Allan Scott, Fannie Hurst"",""Actors"":""Lana Turner, John Gavin, Sandra Dee"",""Plot"":""An aspiring white actress takes in an African-American widow whose mixed-race daughter is desperate to be seen as white."",""Language"":""English"",""Country"":""United States"",""Awards"":""Nominated for 2 Oscars. 4 wins & 7 nominations total"",""Poster"":""https://m.media-amazon.com/images/M/MV5BNjhiYzRiMzMtODMwZS00OWIwLTk3NTgtYjI1MDMxMDU5OWEzXkEyXkFqcGdeQXVyNjc1NTYyMjg@._V1_SX300.jpg"",""Ratings"":[{""Source"":""Internet Movie Database"",""Value"":""7.8/10""},{""Source"":""Rotten Tomatoes"",""Value"":""82%""},{""Source"":""Metacritic"",""Value"":""87/100""}],""Metascore"":""87"",""imdbRating"":""7.8"",""imdbVotes"":""16,670"",""imdbID"":""tt0052918"",""Type"":""movie"",""DVD"":""10 Feb 2004"",""BoxOffice"":""N/A"",""Production"":""N/A"",""Website"":""N/A"",""Response"":""True""}"
North by Northwest	Q223139	Alfred Hitchcock	male	Ernest Lehman	male	North by Northwest	North by Northwest	tt0053125	Action, Adventure, Mystery	97	8.3	English, French	false	Cary Grant, Eva Marie Saint, James Mason	136	Approved	United States	1959	true	true	45	53	"{""Title"":""North by Northwest"",""Year"":""1959"",""Rated"":""Approved"",""Released"":""18 Dec 1959"",""Runtime"":""136 min"",""Genre"":""Action, Adventure, Mystery"",""Director"":""Alfred Hitchcock"",""Writer"":""Ernest Lehman"",""Actors"":""Cary Grant, Eva Marie Saint, James Mason"",""Plot"":""A New York City advertising executive goes on the run after being mistaken for a government agent by a group of foreign spies, and falls for a woman whose loyalties he begins to doubt."",""Language"":""English, French"",""Country"":""United States"",""Awards"":""Nominated for 3 Oscars. 8 wins & 10 nominations total"",""Poster"":""https://m.media-amazon.com/images/M/MV5BZDA3NDExMTUtMDlhOC00MmQ5LWExZGUtYmI1NGVlZWI4OWNiXkEyXkFqcGdeQXVyNjc1NTYyMjg@._V1_SX300.jpg"",""Ratings"":[{""Source"":""Internet Movie Database"",""Value"":""8.3/10""},{""Source"":""Rotten Tomatoes"",""Value"":""97%""},{""Source"":""Metacritic"",""Value"":""98/100""}],""Metascore"":""98"",""imdbRating"":""8.3"",""imdbVotes"":""328,642"",""imdbID"":""tt0053125"",""Type"":""movie"",""DVD"":""03 Nov 2009"",""BoxOffice"":""$66,728"",""Production"":""N/A"",""Website"":""N/A"",""Response"":""True""}"
Some Like It Hot	Q190086	Billy Wilder	male	I. A. L. Diamond&Billy Wilder&Robert Thoeren	male&male&male	Some Like It Hot	Some Like It Hot	tt0053291	Comedy, Music, Romance	94	8.2	English	false	Marilyn Monroe, Tony Curtis, Jack Lemmon	121	Passed	United States	1959	true	true	38	42	"{""Title"":""Some Like It Hot"",""Year"":""1959"",""Rated"":""Passed"",""Released"":""19 Mar 1959"",""Runtime"":""121 min"",""Genre"":""Comedy, Music, Romance"",""Director"":""Billy Wilder"",""Writer"":""Billy Wilder, I.A.L. Diamond, Robert Thoeren"",""Actors"":""Marilyn Monroe, Tony Curtis, Jack Lemmon"",""Plot"":""After two male musicians witness a mob hit, they flee the state in an all-female band disguised as women, but further complications set in."",""Language"":""English"",""Country"":""United States"",""Awards"":""Won 1 Oscar. 15 wins & 15 nominations total"",""Poster"":""https://m.media-amazon.com/images/M/MV5BNzAyOGIxYjAtMGY2NC00ZTgyLWIwMWEtYzY0OWQ4NDFjOTc5XkEyXkFqcGdeQXVyNjU0OTQ0OTY@._V1_SX300.jpg"",""Ratings"":[{""Source"":""Internet Movie Database"",""Value"":""8.2/10""},{""Source"":""Rotten Tomatoes"",""Value"":""94%""},{""Source"":""Metacritic"",""Value"":""98/100""}],""Metascore"":""98"",""imdbRating"":""8.2"",""imdbVotes"":""267,900"",""imdbID"":""tt0053291"",""Type"":""movie"",""DVD"":""18 Jul 2006"",""BoxOffice"":""N/A"",""Production"":""N/A"",""Website"":""N/A"",""Response"":""True""}"
The 400 Blows	Q162331	François Truffaut	male	François Truffaut&Marcel Moussy	male&male	Les Quatre Cents Coups	The 400 Blows	tt0053198	Crime, Drama	99	8.1	French, English	false	Jean-Pierre Léaud, Albert Rémy, Claire Maurier	99	Not Rated	France	1959	true	true	50	39	"{""Title"":""The 400 Blows"",""Year"":""1959"",""Rated"":""Not Rated"",""Released"":""16 Nov 1959"",""Runtime"":""99 min"",""Genre"":""Crime, Drama"",""Director"":""François Truffaut"",""Writer"":""François Truffaut, Marcel Moussy"",""Actors"":""Jean-Pierre Léaud, Albert Rémy, Claire Maurier"",""Plot"":""A young boy, left without attention, delves into a life of petty crime."",""Language"":""French, English"",""Country"":""France"",""Awards"":""Nominated for 1 Oscar. 10 wins & 7 nominations total"",""Poster"":""https://m.media-amazon.com/images/M/MV5BYTQ4MjA4NmYtYjRhNi00MTEwLTg0NjgtNjk3ODJlZGU4NjRkL2ltYWdlL2ltYWdlXkEyXkFqcGdeQXVyNjU0OTQ0OTY@._V1_SX300.jpg"",""Ratings"":[{""Source"":""Internet Movie Database"",""Value"":""8.1/10""},{""Source"":""Rotten Tomatoes"",""Value"":""99%""}],""Metascore"":""N/A"",""imdbRating"":""8.1"",""imdbVotes"":""118,701"",""imdbID"":""tt0053198"",""Type"":""movie"",""DVD"":""09 May 2006"",""BoxOffice"":""$509"",""Production"":""N/A"",""Website"":""N/A"",""Response"":""True""}"
Pickpocket	Q664726	Robert Bresson	male	Robert Bresson	male	Pickpocket	Pickpocket	tt0053168	Crime, Drama	93	7.6	French	false	Martin LaSalle, Marika Green, Jean Pélégri	76	Not Rated	France	1959	false	true		63	"{""Title"":""Pickpocket"",""Year"":""1959"",""Rated"":""Not Rated"",""Released"":""16 Dec 1959"",""Runtime"":""76 min"",""Genre"":""Crime, Drama"",""Director"":""Robert Bresson"",""Writer"":""Robert Bresson"",""Actors"":""Martin LaSalle, Marika Green, Jean Pélégri"",""Plot"":""Michel passes the time by picking pockets, careful to never be caught despite being watched by the police. His friend Jacques may suspect, while both men may have their eyes on Jeanne, the pretty neighbor of Michel's ailing mother."",""Language"":""French"",""Country"":""N/A"",""Awards"":""1 win & 4 nominations"",""Poster"":""https://m.media-amazon.com/images/M/MV5BZWNlMTM4YTYtNWY4NS00MDQzLTkzOWQtYzU0MGUxOTM3NzI3XkEyXkFqcGdeQXVyNjc1NTYyMjg@._V1_SX300.jpg"",""Ratings"":[{""Source"":""Internet Movie Database"",""Value"":""7.6/10""},{""Source"":""Rotten Tomatoes"",""Value"":""93%""}],""Metascore"":""N/A"",""imdbRating"":""7.6"",""imdbVotes"":""22,945"",""imdbID"":""tt0053168"",""Type"":""movie"",""DVD"":""01 Apr 2014"",""BoxOffice"":""N/A"",""Production"":""N/A"",""Website"":""N/A"",""Response"":""True""}"
À bout de souffle	Q86427	Jean-Luc Godard	male	Jean-Luc Godard&François Truffaut	male&male	À bout de souffle	Breathless	tt0053472	Crime, Drama	96	7.7	French, English	false	Jean-Paul Belmondo, Jean Seberg, Daniel Boulanger	90	Not Rated	France	1960	true	true	38	13	"{""Title"":""Breathless"",""Year"":""1960"",""Rated"":""Not Rated"",""Released"":""07 Feb 1961"",""Runtime"":""90 min"",""Genre"":""Crime, Drama"",""Director"":""Jean-Luc Godard"",""Writer"":""François Truffaut, Jean-Luc Godard, Claude Chabrol"",""Actors"":""Jean-Paul Belmondo, Jean Seberg, Daniel Boulanger"",""Plot"":""A small-time thief steals a car and impulsively murders a motorcycle policeman. Wanted by the authorities, he reunites with a hip American journalism student and attempts to persuade her to run away with him to Italy."",""Language"":""French, English"",""Country"":""France"",""Awards"":""Nominated for 1 BAFTA Award5 wins & 4 nominations total"",""Poster"":""https://m.media-amazon.com/images/M/MV5BNTAyY2M0YjEtNTQzOS00MTRjLTk2MDgtMTRkMzJkYzU4ZjJlXkEyXkFqcGdeQXVyNDkzNTM2ODg@._V1_SX300.jpg"",""Ratings"":[{""Source"":""Internet Movie Database"",""Value"":""7.7/10""},{""Source"":""Rotten Tomatoes"",""Value"":""96%""}],""Metascore"":""N/A"",""imdbRating"":""7.7"",""imdbVotes"":""82,431"",""imdbID"":""tt0053472"",""Type"":""movie"",""DVD"":""07 Jan 2003"",""BoxOffice"":""$414,173"",""Production"":""N/A"",""Website"":""N/A"",""Response"":""True""}"
L’avventura	Q514531	Michelangelo Antonioni	male	Elio Bartolini&Tonino Guerra&Michelangelo Antonioni	male&male&male	L'Avventura	L'Avventura	tt0053619	Drama, Mystery, Romance	94	7.8	Italian, English, Greek	false	Gabriele Ferzetti, Monica Vitti, Lea Massari	144	Not Rated	Italy, France	1960	true	true	72	50	"{""Title"":""L'Avventura"",""Year"":""1960"",""Rated"":""Not Rated"",""Released"":""04 Mar 1961"",""Runtime"":""144 min"",""Genre"":""Drama, Mystery, Romance"",""Director"":""Michelangelo Antonioni"",""Writer"":""Michelangelo Antonioni, Elio Bartolini, Tonino Guerra"",""Actors"":""Gabriele Ferzetti, Monica Vitti, Lea Massari"",""Plot"":""A woman disappears during a Mediterranean boating trip. During the search, her lover and her best friend become attracted to each other."",""Language"":""Italian, English, Greek"",""Country"":""Italy, France"",""Awards"":""Nominated for 2 BAFTA 6 wins & 11 nominations total"",""Poster"":""https://m.media-amazon.com/images/M/MV5BNmJlYTVjZTYtZDg1Yy00NzFiLWJmYzYtYTJhMjliY2I2ZTlhXkEyXkFqcGdeQXVyMjgyNjk3MzE@._V1_SX300.jpg"",""Ratings"":[{""Source"":""Internet Movie Database"",""Value"":""7.8/10""},{""Source"":""Rotten Tomatoes"",""Value"":""94%""}],""Metascore"":""N/A"",""imdbRating"":""7.8"",""imdbVotes"":""30,191"",""imdbID"":""tt0053619"",""Type"":""movie"",""DVD"":""01 Apr 2014"",""BoxOffice"":""N/A"",""Production"":""N/A"",""Website"":""N/A"",""Response"":""True""}"
